{
  "schema": "bdb-vnext-m2d-scenario-v1",
  "scenario_version": "m2d-scenario-v1",
  "scenario_id": "S2",
  "scenario_family": "LOCAL_BUG",
  "task_text": "A developer edits a source file in the checkout after RepoSourceEvidence was published. A later FACT validation is reported as either returning the old committed bytes or raising repository_source_mismatch. Diagnose the exact authority path, distinguish a dirty worktree from a real committed-source mismatch, identify the smallest safe regression test and remediation, and do not edit the repository.",
  "repo_view": {
    "repository_id": "bdb-vnext-benchmark-subject",
    "repository_identity_digest": "sha256:fe6decea9b8e31d869f515ed377ac395c4e5e613e666f886cc9e41ef7e089f70",
    "object_format": "sha1",
    "commit_oid": "4b724eda100345969eb236f877dd46f0bb91c0cb",
    "tree_oid": "90ddd52fd997cb67a13767145fd387f7e0ad7141",
    "view_id": "sha256:625e76129333136da65e642c91b52693a9e2f4bc8242ff89c3143e2b9e86518d"
  },
  "evidence_universe": [
    { "path": "bdb_vnext/repo_view.py", "object_id": "ace7141837283be7257067dfa8127a27a6e359ed", "size_bytes": 31726, "raw_sha256": "sha256:e889fbee0a4d7ae195ddca1bc3c7e4f050a531b787554dcfa8e96308ea23f6a0", "role": "exact committed RepoView query/read boundary" },
    { "path": "bdb_vnext/content_store.py", "object_id": "6fada01c12bfec5aaae1100455f8c0c12d04c147", "size_bytes": 31409, "raw_sha256": "sha256:7ccbfc24106d53b03d1af927d14d0d6b81921d6065cf156cfc7cafbb967eebbd", "role": "immutable ContentRef and accepted binding store" },
    { "path": "bdb_vnext/engineering_intelligence.py", "object_id": "b1ab8465d8e944cfac7719a5ade321b041c299c7", "size_bytes": 149421, "raw_sha256": "sha256:5bbe00eb63832185f15ccd0f295f3ed1f1ac71e2ce369221237503a4d10cbc91", "role": "RepoSourceEvidence validation and FACT contract" },
    { "path": "tests/test_vnext_engineering_intelligence.py", "object_id": "2b0cf718cc2d38edf76d8eafe0d18739fc2cb6ea", "size_bytes": 25942, "raw_sha256": "sha256:8acf23fef9d892b714bfd66b3745cece6e593f2e84a7f1d8a587a7bb4e92ca43", "role": "dirty-worktree and tamper regression evidence" }
  ],
  "must_see_ground_truth": [
    { "item_id": "S2-MS-01", "requirement": "M2a read_bytes/read_text are tied to the exact committed Git object database, not the mutable checkout filesystem.", "source_paths": ["bdb_vnext/repo_view.py"], "criticality": "HARD" },
    { "item_id": "S2-MS-02", "requirement": "A dirty worktree after view creation must not change bytes returned by that exact view; a newer commit is a different RepoView basis.", "source_paths": ["bdb_vnext/repo_view.py", "tests/test_vnext_engineering_intelligence.py"], "criticality": "HARD" },
    { "item_id": "S2-MS-03", "requirement": "repository_source_mismatch means the committed entry/object or accepted immutable bytes do not equal; it is not the expected signal for an ordinary dirty checkout.", "source_paths": ["bdb_vnext/engineering_intelligence.py", "bdb_vnext/content_store.py"], "criticality": "MATERIAL" },
    { "item_id": "S2-MS-04", "requirement": "The safe regression test must compare committed bytes and accepted raw bytes before/after a worktree edit and separately exercise fabricated or stale evidence.", "source_paths": ["tests/test_vnext_engineering_intelligence.py"], "criticality": "MATERIAL" }
  ],
  "known_constraints": ["read-only diagnosis", "never read mutable worktree bytes as authority", "same exact RepoView required for source validation", "no retry or repair side effects", "Legacy and runtime are out of scope"],
  "known_unknowns": ["The report does not identify whether the observed mismatch came from a newer RepoView, fabricated M2b bytes, or a wrong repository; the answer must keep those hypotheses separate."],
  "source_inference_distinctions": [
    { "distinction_id": "S2-SI-01", "statement": "Dirty checkout content is an observation about the worktree, not exact committed source authority." },
    { "distinction_id": "S2-SI-02", "statement": "An error code alone cannot prove which mismatch branch occurred without the bound view/object evidence." }
  ],
  "adjudication_vector_ids": ["semantic_correctness", "repository_understanding_must_see_coverage", "root_cause_or_ownership_accuracy", "explicit_unknowns_uncertainty", "constraint_violations", "validation_relevance_missed_risks", "rework_required", "browser_continuity", "protocol_burden_visible_to_gpt"],
  "arm_construction": { "version": "m2d-arm-construction-v1", "baseline_type": "BASELINE_FLAT_CONTEXT_V1", "m2_type": "M2_VNEXT_CONTEXT_PACKAGE_V1", "initial_visible_paths": ["bdb_vnext/repo_view.py", "bdb_vnext/content_store.py", "bdb_vnext/engineering_intelligence.py", "tests/test_vnext_engineering_intelligence.py"] },
  "context_seed": null,
  "browser_assets": {
    "version": "m2d-browser-assets-v1",
    "arm_x_prompt_sha256": "sha256:bd14baad6450b4726aa9cfd2c3e734238fd031ad2dd4eac90ac0145178e4b131",
    "arm_y_prompt_sha256": "sha256:3c6cab2766550dffc0cb28ea54b942587f75bfda291fbb0ad3cd21caea10fe91",
    "arm_x_initial_payload_manifest_digest": "sha256:d4c3be2e44e70b0e5c989a5adf76039aa95068993c8916a060186def6fd59b61",
    "arm_x_initial_payload_manifest_sha256": "sha256:b5995b64f27e05115f6c611fa43013956a1a600472e9a62d7f9eb725595dc3d7",
    "arm_x_initial_payload_digest": "sha256:aeb4715aeda23c5eb5494efe66439946c74183e57b42aaaafb2870308e6dbd03",
    "arm_y_initial_payload_manifest_digest": "sha256:48c57e7acc3e829fedb9e13507383723f1d6913137f03e9392f98c067e04e877",
    "arm_y_initial_payload_manifest_sha256": "sha256:8cdcfaf3ba05145a0525faa2f2339dc7d785da99a6a151255c329d57a4b01d6c",
    "arm_y_initial_payload_digest": "sha256:17c4e5917d242340a0f47d27413f82889133d45ae2722fa157b02af5f6998e3b",
    "s5_followup_operator_message_sha256": null,
    "s5_followup_payload_manifest_digest": null,
    "s5_followup_payload_manifest_sha256": null,
    "s5_followup_payload_digest": null
  },
  "rubric_version": "m2d-rubric-v1",
  "gate_policy_version": "m2d-gate-policy-v1",
  "scenario_digest": "sha256:a41ec0b6543322d5d7e9e8fe9e86da5542915f7ce8f6053471e3f13a2a9d8832"
}
